{
  "method": "PUT",
  "path": "/b/v1/market/cds/cancel-order",
  "summary": "TODO_AI_ENRICH",
  "specs": {
    "request": {
      "params": [],
      "body": null,
      "validation": [
        {
          "field": "String",
          "type": "Custom",
          "required": false,
          "rules": "validateOwnerOrder"
        },
        {
          "field": "valContext",
          "type": "Custom",
          "required": false,
          "rules": "validate"
        }
      ]
    },
    "response": {
      "body": null,
      "codes": [
        {
          "code": 200,
          "description": "Success"
        },
        {
          "code": 400,
          "description": "TcbsException: TcbsErrorCode.INVALID_ORDER_STATUS"
        },
        {
          "code": 400,
          "description": "TcbsException: TcbsErrorCode.UNKNOWN_ERROR"
        },
        {
          "code": 400,
          "description": "TcbsException: TcbsErrorCode.CD_ERROR_GET_DATA_FROM_BANK"
        },
        {
          "code": 400,
          "description": "TcbsException: TcbsErrorCode.CUSTOMER_NOT_FOUND"
        },
        {
          "code": 400,
          "description": "TcbsException: TcbsErrorCode.FIND_BOND_PLEDGE_BY_CUSTOMERTCBSID_ERROR"
        },
        {
          "code": 400,
          "description": "TcbsException: TcbsErrorCode.REST_ERROR"
        }
      ]
    }
  },
  "externalDependencies": {
    "downstreamApis": [
      {
        "serviceName": "unknown-service",
        "endpoint": "POST url",
        "condition": "TODO_AI_ENRICH",
        "purpose": "TODO_AI_ENRICH"
      },
      {
        "serviceName": "unknown-service",
        "endpoint": "EXCHANGE url",
        "condition": "TODO_AI_ENRICH",
        "purpose": "TODO_AI_ENRICH"
      }
    ],
    "messaging": {
      "outbound": [],
      "inbound": [
        {
          "topic": "b.e.q.trading.005032",
          "payload": {
            "serialVersionUID": 0,
            "eventCode": "string",
            "data": {
              "serialVersionUID": 0,
              "order": {
                "serialVersionUID": 0,
                "orderId": 0,
                "action": "string",
                "customerTcbsId": "string",
                "quantity": 0,
                "price": 0,
                "principal": 0,
                "unitPrice": 0,
                "purchaserTcbsid": "string",
                "productCode": "string",
                "bondCode": "string",
                "status": "string",
                "startDate": "2024-01-01",
                "expiredDate": "2024-01-01",
                "rate": 0,
                "autoMatching": "string",
                "referenceStatus": 0,
                "marketType": "string",
                "transactionId": "string",
                "directStatus": 0,
                "referralCode": "string",
                "isDirect": 0,
                "remainVolume": 0,
                "agreementCode": "string",
                "orderCode": "string",
                "recommendedStatus": 0,
                "listedBond": 0,
                "cpCustType": "string",
                "orderType": 0,
                "reinvestRate": 0,
                "accountNo": "string",
                "isBondSwitching": false,
                "normalizedId": "string",
                "voucherCode": "string",
                "counterParty": "string",
                "counterOrderId": 0,
                "discount": 0,
                "bondConditionDetailId": 0,
                "bondConditionId": 0,
                "buyPrincipal": 0,
                "buyContractDate": "2024-01-01",
                "pnlRate": 0,
                "fineAmount": 0,
                "isCombo": false,
                "fundCode": "string",
                "route": "string",
                "iconnectOrderType": "string",
                "orderAttrs": [
                  {
                    "id": 0,
                    "name": "string",
                    "value": "string",
                    "caption": "string",
                    "orderId": 0,
                    "createdTime": "2024-01-01",
                    "updatedTime": "2024-01-01",
                    "appliedDate": "2024-01-01"
                  }
                ],
                "confirmUrl": "string",
                "rateType": 0
              },
              "rate": 0,
              "productCode": "string",
              "startDate": "2024-01-01",
              "expiredDate": "2024-01-01",
              "originVolume": 0,
              "remainingVolume": 0,
              "remainingInvestmentAmount": 0,
              "matchingVolume": 0,
              "suggestions": [
                {
                  "serialVersionUID": 0,
                  "orderId": 0,
                  "referenceAssetsId": 0,
                  "customerTcbsId": "string",
                  "customerCustodyCode": "string",
                  "customerName": "string",
                  "action": "string",
                  "productCode": "string",
                  "startDate": "2024-01-01",
                  "expiredDate": "2024-01-01",
                  "quantity": 0,
                  "status": "string",
                  "ytmReinvestedPers": 0,
                  "ytmReinvestedCorp": 0,
                  "unitPrice": 0,
                  "matchedVolume": 0,
                  "remainVolume": 0,
                  "matchingDate": "2024-01-01",
                  "investmentAmount": 0,
                  "cpCustodyCode": "string"
                }
              ],
              "status": "string",
              "checksum": "string",
              "signature": "string",
              "transactionId": "string",
              "beginningHold": "2024-01-01",
              "remainingTime": 0,
              "bondConditionId": 0,
              "bondConditionDetailId": 0,
              "recommendedRate": 0,
              "rbVolume": 0,
              "captcha": {
                "captchaToken": "string",
                "captchaVersion": 0
              }
            },
            "status": "string"
          },
          "consumptionLogic": "BondEventHandlerImpl.startUnholdSuggestionOrderMarket()"
        }
      ]
    },
    "persistence": [
      {
        "database": "TODO_AI_ENRICH",
        "tables": "orderMarket, orderMarketAttr, cdBankTransaction, customer, trading, experienceOrder, bond, tradingSellIconnect, tradingAttr, issuer",
        "storedProcedures": "None detected"
      }
    ]
  },
  "logicFlow": "TODO_AI_ENRICH",
  "codeDiagram": "graph TB\n  subgraph Controller\n    A[cancelOrderfromBackend]\n  end\n  subgraph Service\n    B[cancelOrderFromBackend]\n    C[cancelOrderFromBackend]\n  end\n  A --> B\n  B --> C",
  "cacheStrategy": {
    "population": [],
    "invalidation": [],
    "update": [],
    "flow": ""
  },
  "retryLogic": [],
  "keyDetails": {
    "transactionManagement": [
      "@Transactional on cancelOrderFromBackend"
    ],
    "businessRules": [],
    "security": []
  }
}
